near_miss_id,site_id,report_date,hazard_category,shift,location_on_site,potential_severity,corrective_action_taken,description
644,9,2023-10-07,Fall from height,Afternoon,Workshop,Low,False,Tempore cum optio consequatur corporis beatae ipsam molestias delectus vitae fugit vitae consequuntur et blanditiis ipsam incidunt.
645,10,2023-07-01,Mobile equipment,Day,Workshop,Low,True,Necessitatibus libero a maiores modi fugiat tenetur vitae veniam magnam omnis quisquam voluptatum.
646,10,2026-03-13,Ground fall,Day,Haul road,Low,True,Similique eaque similique nemo quibusdam porro unde cum nesciunt dicta minima.
647,10,2023-05-28,Ground fall,Afternoon,Underground,Low,True,Iste nostrum placeat beatae temporibus officiis iusto consequuntur.
648,10,2024-05-14,Mobile equipment,Afternoon,Camp,Medium,True,Quaerat consectetur est temporibus dignissimos eos ea natus quaerat aspernatur.
649,10,2025-06-26,Explosives,Afternoon,Workshop,Low,False,Ratione minus architecto accusantium necessitatibus occaecati vel error saepe dicta ex temporibus consequuntur similique pariatur quo dolorum unde vel.
650,10,2025-12-24,Hazardous substances,Day,Workshop,High,True,Fuga quos blanditiis quidem quidem incidunt facilis hic atque adipisci tempora nulla vitae enim eaque tempore.
651,10,2023-12-11,Mobile equipment,Afternoon,Underground,Medium,True,Occaecati saepe ipsum molestiae similique pariatur ea repudiandae repellendus nesciunt modi similique et cumque a ipsum alias cumque dolore.
652,10,2023-08-20,Ground fall,Afternoon,Workshop,Low,False,Dicta repellendus totam recusandae provident id illum quaerat doloribus nisi inventore tempora cumque architecto distinctio alias.
653,10,2024-07-12,Mobile equipment,Afternoon,Camp,Medium,False,Dignissimos officia esse nisi cumque modi facere qui totam consequatur placeat architecto laudantium vero temporibus expedita assumenda alias.
654,10,2023-09-26,Ground fall,Afternoon,Camp,High,False,Quam debitis voluptas illo magni assumenda labore fugit autem.
655,10,2025-04-20,Fall from height,Night,Camp,Low,True,Fugiat labore error fugiat commodi molestiae quisquam in quisquam quam impedit asperiores odio.
656,10,2025-12-08,Electrical,Day,Processing plant,Medium,True,Aliquid cum sapiente cupiditate ab dolore iste dignissimos expedita nihil laborum quae sapiente.
657,10,2025-11-17,Mobile equipment,Afternoon,Underground,Low,True,Odit laudantium neque delectus aspernatur aspernatur voluptate tempore velit eaque vitae laboriosam quas officiis sit molestiae fugiat eum.
658,10,2024-10-16,Ground fall,Night,Workshop,Medium,True,Cupiditate sit deleniti nisi aliquid vero laudantium dicta recusandae veniam error.
659,10,2025-04-23,Explosives,Afternoon,Open pit,Low,False,Veritatis corrupti molestias tempora quod similique facere impedit optio voluptatibus placeat totam repellat quam at.
660,10,2025-05-29,Explosives,Night,Processing plant,Medium,True,Facilis sapiente eius inventore accusantium repellat accusantium maxime non cum quam aliquam.
661,10,2025-05-02,Ground fall,Night,Underground,Low,True,Accusantium pariatur alias minima quas unde ab nostrum dignissimos veniam ut aspernatur reiciendis doloribus vel tempora.
662,10,2024-10-02,Mobile equipment,Night,Camp,High,False,Cumque cumque alias non itaque harum nulla dicta consectetur distinctio at.
663,10,2023-07-26,Mobile equipment,Night,Haul road,High,True,Maxime magnam officia provident perferendis cupiditate rerum optio quo minus excepturi dolorem fugiat libero hic nisi ratione molestiae.
664,10,2025-11-03,Mobile equipment,Night,Open pit,Medium,False,Eligendi reiciendis amet nisi ratione qui nulla aperiam facilis inventore assumenda vel culpa sit magnam quis.
665,10,2025-08-23,Mobile equipment,Afternoon,Open pit,Medium,False,Nihil magnam eaque provident asperiores vitae esse voluptas ut atque nisi sunt sed consequuntur eligendi.
666,10,2024-07-04,Ground fall,Night,Camp,Low,False,Reprehenderit in quaerat corrupti recusandae dicta itaque minus soluta accusamus.
667,10,2024-04-02,Electrical,Afternoon,Workshop,High,True,Error aliquam expedita excepturi ducimus officiis aliquid soluta hic mollitia quasi cupiditate quaerat reiciendis laborum.
668,10,2025-07-21,Hazardous substances,Night,Underground,Medium,False,Ipsa atque sapiente cupiditate quibusdam at nulla optio quidem eligendi impedit nisi commodi nulla.
669,10,2024-03-03,Mobile equipment,Night,Open pit,Low,False,Iusto doloribus tempore reiciendis iusto repellendus sequi esse assumenda saepe animi.
670,10,2025-04-10,Mobile equipment,Day,Haul road,Low,True,Magnam deleniti officiis autem maiores a molestiae aliquid illum eos corporis doloremque.
671,10,2024-09-12,Ground fall,Afternoon,Underground,Medium,True,Nemo quis tenetur velit nemo nihil deserunt facere corporis a.
672,10,2024-08-08,Mobile equipment,Day,Processing plant,High,False,Voluptas ratione non est molestias hic eos totam vel explicabo laborum ad.
673,10,2024-12-24,Ground fall,Night,Camp,Medium,True,Modi nihil similique doloribus optio esse minima ab error molestiae consequatur sequi temporibus necessitatibus repellendus perferendis.
674,10,2024-02-18,Mobile equipment,Night,Underground,High,False,Sapiente corporis quis aspernatur qui omnis minima commodi molestias expedita molestiae maiores excepturi recusandae in illum.
675,10,2023-07-09,Explosives,Day,Workshop,High,False,Vel ex delectus sint soluta fugiat amet dignissimos exercitationem suscipit quo dolorem dicta praesentium sed.
676,10,2025-05-29,Ground fall,Night,Underground,Low,False,Suscipit et ipsa harum ab neque consequuntur blanditiis quasi nam delectus accusantium.
677,10,2025-02-20,Ground fall,Night,Underground,Medium,True,Fugit ipsa facere distinctio illo vitae consequuntur perferendis quas eaque earum nesciunt illo.
678,10,2026-05-11,Ground fall,Night,Camp,Medium,True,Nobis ut nemo blanditiis voluptates dolor aut nemo delectus delectus tempore consequatur eos dolorum.
679,10,2024-07-26,Fall from height,Night,Processing plant,Medium,True,Corrupti dolorum fugiat id quo itaque aperiam voluptas laborum distinctio id voluptatem.
680,10,2023-06-16,Hazardous substances,Day,Camp,Low,False,Impedit aperiam veniam reprehenderit eaque laboriosam mollitia incidunt laborum quidem dolores enim quibusdam.
681,10,2024-07-21,Ground fall,Afternoon,Processing plant,High,True,Voluptate velit laborum non illo tempore sed omnis rem ullam deserunt.
682,10,2025-10-01,Ground fall,Day,Open pit,Low,True,Optio vitae maiores distinctio ut mollitia iusto tenetur distinctio ex nisi ducimus facere consectetur.
683,10,2023-12-14,Ground fall,Afternoon,Underground,Low,False,Molestiae repudiandae eaque consequuntur fuga sapiente velit perferendis vitae optio voluptatem blanditiis alias ipsam voluptas distinctio.
684,10,2026-01-05,Mobile equipment,Night,Haul road,Medium,True,Earum earum itaque quia deserunt nobis dicta beatae.
685,10,2023-12-15,Mobile equipment,Night,Processing plant,Low,False,Odit illum pariatur quas occaecati officia harum placeat suscipit sit quod inventore.
686,10,2025-01-19,Explosives,Afternoon,Underground,Medium,True,Ullam eius deleniti eveniet modi nisi pariatur dolores dolore aspernatur natus cupiditate possimus deleniti ab eveniet ad.
687,10,2024-06-01,Mobile equipment,Afternoon,Camp,Low,True,Iusto voluptatem non corporis asperiores est eveniet enim odit eos eaque laudantium assumenda iste cupiditate ut ratione.
688,10,2023-10-31,Manual handling,Day,Underground,Medium,True,Nemo inventore praesentium veritatis iste facere minima libero eveniet fuga dolore nostrum deserunt nam iure iure est quidem.
689,10,2025-12-12,Mobile equipment,Night,Haul road,Low,False,Corporis qui quasi dignissimos perspiciatis quam quam dolor tenetur odit tempora.
690,10,2024-03-25,Manual handling,Night,Processing plant,Low,False,Fugiat tenetur eum facere temporibus voluptatem dicta dolor.
691,10,2024-10-05,Electrical,Afternoon,Open pit,High,False,A ullam ipsa nostrum eligendi porro iusto saepe officia ut laudantium animi ab repudiandae aliquam placeat.
692,10,2024-03-13,Ground fall,Day,Haul road,High,False,In saepe quisquam eligendi in earum possimus vero unde cupiditate incidunt deserunt doloribus est repellendus omnis est quas.
693,10,2023-07-11,Explosives,Night,Camp,Low,True,Pariatur nulla sapiente eaque saepe vel consequatur quibusdam cupiditate in blanditiis quia dolorum similique sit architecto a fuga.
694,10,2024-08-10,Electrical,Afternoon,Haul road,Medium,False,Quisquam perspiciatis maxime veniam nam quasi dolore saepe laudantium blanditiis sed repellat quos.
695,10,2025-04-11,Mobile equipment,Afternoon,Underground,Low,True,Repellendus modi voluptatibus et illo explicabo recusandae sunt doloribus blanditiis mollitia aliquid incidunt a.
696,10,2026-05-15,Mobile equipment,Day,Haul road,Medium,True,Quaerat recusandae voluptas culpa vero voluptates nemo natus qui nisi repellat facere ut qui maxime.
697,10,2025-03-08,Manual handling,Afternoon,Camp,Medium,False,Perspiciatis quam fugiat corporis accusamus eligendi alias nihil officia.
698,10,2025-07-29,Explosives,Day,Processing plant,Medium,True,Sed consequuntur animi modi fugit totam voluptatum quam voluptatibus similique ab soluta incidunt voluptas saepe repellendus vitae.
699,10,2023-12-10,Ground fall,Day,Haul road,High,True,Inventore ipsam temporibus iure accusamus vero velit laboriosam quasi autem provident qui deserunt excepturi.
700,10,2026-01-28,Fall from height,Afternoon,Workshop,High,False,Modi maxime distinctio praesentium minus ducimus eveniet magni hic.
701,10,2023-11-04,Ground fall,Day,Camp,Medium,True,Distinctio omnis vitae ratione placeat dolorem nulla vel quo reprehenderit repellendus minus deserunt veniam molestias.
702,10,2025-11-29,Mobile equipment,Afternoon,Processing plant,Low,True,Soluta veniam nulla excepturi deserunt provident sint ullam iusto.
703,10,2025-11-24,Ground fall,Afternoon,Camp,Low,False,At reiciendis possimus odit laborum dolore et suscipit soluta nulla deserunt.
704,10,2025-12-27,Electrical,Day,Processing plant,Medium,False,Voluptatum deleniti quod a mollitia cum rerum tempora saepe suscipit cum quisquam adipisci rerum repellat provident commodi quae.
705,10,2023-11-28,Manual handling,Night,Processing plant,Low,False,Perferendis officia explicabo incidunt ut perspiciatis est molestias esse consequatur mollitia commodi tempore saepe animi sit quod quam.
706,10,2023-05-28,Mobile equipment,Afternoon,Workshop,Low,True,Et dolore vero quibusdam veritatis facilis nemo officia sunt quasi eius occaecati dignissimos laborum ipsum.
707,10,2023-09-12,Manual handling,Afternoon,Underground,High,True,Perferendis magni ipsum hic neque eum cum incidunt eos.
708,10,2024-07-21,Electrical,Night,Haul road,High,True,Iste quaerat dolorum praesentium deleniti delectus modi eius.
709,10,2023-09-14,Mobile equipment,Day,Processing plant,Medium,False,Sed facilis tempore et quia alias recusandae autem animi delectus dolores quam.
710,10,2024-07-01,Hazardous substances,Day,Haul road,Low,True,Amet odio minus odit similique tenetur dolore modi aut error tempora maxime perferendis illo earum delectus.
711,10,2025-08-08,Ground fall,Afternoon,Processing plant,High,True,Commodi blanditiis quo aperiam veritatis natus veniam consequatur nam repudiandae ut libero odio ut sed voluptatem officiis tempora eaque.
712,10,2023-06-07,Electrical,Night,Haul road,High,False,Error deleniti labore voluptatum amet labore dolorum ipsam ex.
713,10,2024-05-08,Hazardous substances,Night,Processing plant,Low,False,Facere commodi quos voluptatibus quae corporis fuga nostrum commodi sapiente quae fuga voluptatum explicabo.
714,10,2025-07-16,Explosives,Day,Processing plant,Medium,True,Aspernatur quasi minima placeat voluptate nihil quia earum adipisci quis repellat recusandae dolores laboriosam quam quo omnis id voluptates.
715,10,2025-12-10,Fall from height,Afternoon,Camp,Low,True,Rerum nostrum in fugiat dolore velit nihil mollitia dolorem consequuntur ullam.
716,10,2024-05-23,Ground fall,Night,Open pit,Low,False,Quo facere qui quisquam iste molestiae consequatur recusandae tempore cupiditate sed odit vero assumenda reiciendis sequi magni minus.
717,10,2025-07-20,Ground fall,Afternoon,Workshop,High,True,Sapiente consequuntur voluptatibus totam laboriosam velit consequuntur libero tenetur earum est quasi aspernatur similique eligendi temporibus similique laboriosam optio.
718,10,2024-06-29,Mobile equipment,Night,Haul road,Low,True,Sint blanditiis veniam dolor ipsam eos sit dolorum asperiores est odio.
719,10,2024-09-27,Mobile equipment,Day,Camp,High,True,Modi sapiente alias blanditiis ducimus velit ipsam accusamus quia eaque nesciunt suscipit.
720,10,2026-05-23,Fall from height,Day,Workshop,Low,True,Explicabo error laudantium voluptate animi numquam quo dolores id aut occaecati delectus voluptas consectetur iusto.
721,10,2025-10-23,Ground fall,Night,Haul road,Low,False,Ipsa soluta esse harum perspiciatis in porro aut blanditiis incidunt dolorem similique excepturi delectus fuga corrupti magni.
722,10,2025-02-05,Ground fall,Night,Processing plant,High,True,Nobis aut aperiam quia doloremque harum perspiciatis sit.
723,10,2024-04-12,Mobile equipment,Day,Open pit,Medium,True,Ex facere ullam tempore cumque hic at quis dolorum distinctio.
724,10,2025-11-21,Fall from height,Afternoon,Underground,High,False,Nam vero saepe hic omnis ut eos ipsa perferendis.
725,10,2023-11-13,Mobile equipment,Afternoon,Haul road,Medium,False,Nihil iste labore ipsam ea repellendus libero reprehenderit cum omnis necessitatibus consequuntur modi cum porro quia nisi.
726,10,2025-02-22,Mobile equipment,Night,Open pit,High,False,Exercitationem consequuntur doloribus vitae ab sequi corrupti temporibus.
727,10,2025-08-14,Mobile equipment,Night,Workshop,Low,True,Quo iusto ipsum minima laboriosam a aperiam velit iste vitae nobis minima dicta architecto.
728,10,2026-02-04,Mobile equipment,Day,Camp,Medium,True,Autem ratione autem sunt quibusdam maxime tempore porro.
729,10,2026-01-10,Fall from height,Night,Haul road,Low,True,Iste dolore sed nihil incidunt velit corrupti quas dolores ex ad excepturi animi aliquid molestias minima pariatur vel.
730,10,2024-02-18,Ground fall,Day,Underground,Low,True,Provident quos officiis quae voluptatem accusantium veritatis reprehenderit ab minima illo cum blanditiis.
731,10,2024-11-20,Explosives,Night,Workshop,Low,True,Rem ipsam ipsum nostrum eveniet ratione unde sequi quaerat iure enim ea.
732,10,2025-05-15,Mobile equipment,Day,Haul road,Low,True,Odit similique aliquid dolore earum aliquid voluptatibus ex perspiciatis ipsum voluptatem asperiores earum ut repudiandae.
733,10,2024-09-03,Explosives,Night,Open pit,Medium,True,Quas sequi ipsum consequuntur quidem repudiandae voluptates quos dolores tempora cum incidunt accusamus quo eaque quia.
734,10,2024-10-07,Mobile equipment,Afternoon,Underground,Low,True,Cum ex iusto fugit at consequuntur ullam ducimus dicta quaerat beatae repellat tempore officiis vitae error.
735,10,2023-11-23,Electrical,Afternoon,Workshop,Medium,False,Laboriosam quia aperiam veniam quo inventore est veritatis minus hic possimus quaerat ratione perferendis architecto dolorem eos.
736,10,2024-06-03,Mobile equipment,Day,Camp,Low,True,Fugiat libero debitis necessitatibus numquam tempore eius voluptate.
737,10,2024-07-08,Mobile equipment,Day,Camp,High,True,Corrupti molestiae praesentium officia rerum nostrum commodi natus minima veniam aut quis maxime.
738,10,2024-11-06,Mobile equipment,Afternoon,Workshop,Low,False,Fuga eveniet et animi magnam nisi magni nostrum.
739,10,2024-02-14,Ground fall,Afternoon,Underground,Low,True,Nesciunt error quasi quae quaerat enim nemo nobis eaque alias dolor perspiciatis a esse aliquam ipsa voluptates nihil.
740,10,2025-01-12,Explosives,Night,Processing plant,Low,False,Accusantium voluptas iure possimus omnis quaerat ex eos magnam vel velit veniam occaecati deserunt earum sequi magnam consequuntur.
741,10,2025-08-18,Ground fall,Afternoon,Underground,Medium,False,Totam quasi dolores deserunt deserunt occaecati ullam ab modi beatae adipisci dolores labore.
742,10,2025-04-12,Ground fall,Day,Workshop,High,True,Earum sit tempore porro doloremque ratione cum ratione eum laudantium voluptas at fugit molestias accusantium.
743,10,2024-11-06,Fall from height,Afternoon,Processing plant,High,True,Voluptate fugit aliquam libero animi impedit at esse nulla eos ipsum deserunt vero ea cum consequatur.
744,10,2023-10-26,Mobile equipment,Night,Processing plant,Medium,False,Vitae delectus nihil praesentium commodi neque ipsam a inventore quaerat amet odit hic blanditiis consequatur quaerat debitis quia debitis.
745,10,2023-12-01,Mobile equipment,Afternoon,Underground,Medium,True,Omnis fuga tempora qui illo ipsam tempore sunt facere totam sed mollitia.
746,10,2024-07-17,Ground fall,Day,Camp,Medium,False,Illo nulla totam occaecati quidem in facere architecto mollitia voluptatibus consequuntur.
747,10,2023-08-17,Ground fall,Night,Haul road,High,True,Cum in accusamus dolore aspernatur minus voluptas soluta suscipit dolorum cum ut suscipit.
748,10,2026-02-18,Ground fall,Night,Processing plant,High,False,Nisi voluptatem corporis corrupti error iste consequuntur sapiente ipsam quia sunt non quasi illum veritatis illum fuga hic eum.
749,10,2024-10-22,Fall from height,Afternoon,Camp,High,False,Voluptates fugiat animi praesentium quo ad molestias quo nam aspernatur quam cumque incidunt ullam nulla consectetur provident.
750,10,2025-07-24,Explosives,Day,Open pit,High,True,Praesentium tempora aut possimus dignissimos ab quo officia debitis ducimus velit quidem ullam corporis a perspiciatis ipsa explicabo aut.
751,10,2025-12-29,Ground fall,Afternoon,Processing plant,Low,True,Repellat vel voluptatum quo velit ullam necessitatibus alias molestias recusandae similique quo quasi natus dicta illum quaerat tempora praesentium.
752,10,2026-05-08,Fall from height,Night,Open pit,Low,True,Eos facere quis nobis nulla asperiores atque fugiat enim ipsam facere cumque neque ducimus.
753,10,2025-10-09,Mobile equipment,Night,Haul road,Medium,False,Iusto eaque sint magni eos voluptas nostrum aliquam officia rem nemo doloribus.
754,10,2025-06-13,Ground fall,Day,Underground,Low,False,Molestias voluptate officia laborum odio exercitationem quasi eos reiciendis veritatis soluta magni.
755,10,2026-05-08,Explosives,Afternoon,Processing plant,High,False,Esse officia reiciendis quam ea veritatis explicabo neque dolore quam molestiae.
756,10,2025-05-15,Fall from height,Night,Workshop,High,False,Harum voluptatibus repellendus facilis corporis commodi quaerat earum esse molestias illo deleniti.
757,10,2025-08-19,Ground fall,Afternoon,Haul road,Low,True,Aperiam sequi repellendus nesciunt sint consectetur beatae non cum quisquam non accusamus dolor molestiae occaecati.
758,10,2024-04-12,Mobile equipment,Afternoon,Processing plant,Medium,True,Assumenda natus omnis non beatae vero magni perspiciatis deserunt fugit vel tempore aliquid totam porro quisquam commodi in.
759,10,2025-06-05,Mobile equipment,Afternoon,Underground,Medium,True,Eaque dicta cum repellat ratione earum exercitationem deleniti dolorum recusandae beatae quam.
760,11,2023-12-29,Ground fall,Night,Underground,Low,False,Repellat voluptatem velit laudantium error officiis error sed minus rem.
761,11,2024-05-07,Electrical,Day,Workshop,Medium,True,Consequuntur iusto sapiente quisquam praesentium molestias magnam rerum accusamus dolores neque odit sapiente.
762,11,2025-10-10,Ground fall,Night,Workshop,High,True,Aspernatur esse neque tempore nostrum id quia harum voluptatem fugiat.
763,11,2023-07-24,Ground fall,Day,Underground,Medium,True,Maxime quibusdam libero ea impedit esse corporis eligendi quibusdam adipisci recusandae suscipit laborum excepturi occaecati earum ducimus.
764,11,2024-10-14,Ground fall,Day,Haul road,Medium,True,Laudantium hic delectus illo repudiandae aut consequuntur doloribus expedita inventore quam ipsa laboriosam accusantium facilis repellat.
765,11,2023-06-01,Manual handling,Night,Haul road,Medium,True,Corrupti ad totam nesciunt delectus eius ratione cupiditate expedita quas voluptas.
766,11,2024-10-07,Ground fall,Day,Haul road,Low,True,Reiciendis saepe nisi nihil omnis exercitationem cumque nihil nisi fugiat nihil eveniet voluptatibus ab recusandae perferendis doloribus.
767,11,2025-10-24,Electrical,Night,Haul road,High,True,Adipisci officiis aliquam aliquid non odit quisquam quos repellat reiciendis explicabo occaecati.
768,11,2023-07-26,Ground fall,Night,Processing plant,High,True,At harum error mollitia placeat voluptatem tempora nemo vel et numquam natus est quaerat doloribus ipsam alias autem.
769,11,2025-06-02,Fall from height,Night,Camp,Low,False,Labore doloremque at minus neque veritatis facilis debitis dolor nemo expedita iusto.
770,11,2024-04-26,Electrical,Day,Workshop,Medium,True,Earum molestiae doloremque eum modi fugiat aut corrupti velit eos vitae eligendi dolores et a.
771,11,2024-04-02,Ground fall,Night,Underground,High,False,Recusandae suscipit praesentium sapiente optio veniam atque sequi minima.
772,11,2024-11-11,Ground fall,Night,Processing plant,Medium,False,Animi tempore explicabo id tenetur perspiciatis amet reiciendis perferendis corrupti debitis eum.
773,11,2023-10-30,Fall from height,Day,Open pit,High,True,Dolores totam suscipit temporibus neque aut molestiae nesciunt ullam quo asperiores quos repellendus quam.
774,11,2023-10-12,Manual handling,Night,Open pit,High,False,Pariatur adipisci commodi doloribus unde cupiditate sunt officiis tempore aut nobis qui consectetur adipisci.
775,11,2024-11-13,Ground fall,Day,Underground,High,True,Consequatur odio unde non repudiandae ullam error deleniti assumenda cum molestiae.
776,11,2025-10-02,Explosives,Day,Underground,Low,True,Quis nostrum enim recusandae ullam soluta repellendus doloremque nobis illum omnis at in cumque.
777,11,2024-10-12,Mobile equipment,Day,Camp,Medium,True,Quidem dolorem omnis ut soluta perspiciatis doloribus quidem excepturi occaecati necessitatibus quaerat saepe.
778,11,2023-10-21,Fall from height,Day,Open pit,High,True,Consequatur enim modi impedit aut facilis quos vero ut eos cumque.
779,11,2026-04-02,Mobile equipment,Afternoon,Camp,Medium,True,At sunt adipisci perspiciatis ipsa iure cum officiis minus delectus deserunt veniam eligendi minima velit quisquam.
780,11,2026-03-25,Fall from height,Day,Workshop,Medium,True,Quo pariatur aperiam nobis magnam eum soluta eos itaque error.
781,11,2024-06-14,Ground fall,Day,Haul road,Low,False,Animi voluptas nam at facilis ratione dolores officiis ipsum saepe laboriosam provident quos incidunt perspiciatis cum adipisci dolores.
782,11,2023-09-30,Ground fall,Day,Underground,Low,True,Veritatis non expedita aut est quos voluptatibus aliquid natus suscipit qui vero repudiandae error tenetur.
783,11,2025-06-20,Mobile equipment,Afternoon,Underground,High,True,Veniam unde ullam nulla nihil esse sint reprehenderit nam adipisci.
784,11,2026-04-10,Mobile equipment,Night,Camp,High,False,Quis deserunt laboriosam molestias natus doloremque a inventore quibusdam accusamus repudiandae perspiciatis quaerat debitis vitae commodi modi odit quod.
785,11,2025-09-10,Hazardous substances,Day,Haul road,High,True,Corporis corrupti velit excepturi inventore nihil suscipit doloribus odit provident eveniet reprehenderit ratione veritatis quis tempore suscipit.
786,11,2025-05-27,Manual handling,Afternoon,Underground,High,False,Odit explicabo accusamus non laboriosam fugiat similique rem quos accusamus dolore velit voluptate recusandae doloremque ea non molestias.
787,11,2024-07-22,Mobile equipment,Afternoon,Haul road,Low,True,Quas eaque omnis natus esse culpa ex deleniti incidunt fugiat praesentium laudantium.
788,11,2025-05-18,Ground fall,Afternoon,Workshop,High,False,Consectetur deserunt quam debitis possimus necessitatibus laboriosam porro accusantium eum maxime.
789,11,2024-12-27,Hazardous substances,Night,Open pit,High,True,Provident incidunt voluptate dolorem exercitationem natus iusto quo harum voluptas quidem possimus repellendus magni reiciendis dignissimos cumque.
790,11,2026-01-22,Hazardous substances,Day,Camp,High,True,Nihil suscipit ut assumenda sequi labore eum non.
791,11,2025-07-15,Fall from height,Afternoon,Camp,High,True,Esse doloribus facilis dolores laboriosam culpa eos fuga cupiditate.
792,11,2023-08-15,Ground fall,Day,Haul road,Low,True,Excepturi repellendus quam itaque rerum unde est mollitia.
793,11,2025-10-03,Ground fall,Day,Haul road,High,True,Magni ullam quas asperiores tenetur sequi nisi eveniet cupiditate nisi commodi ullam inventore totam similique vero labore deleniti.
794,11,2026-03-30,Ground fall,Night,Open pit,Medium,True,Ab hic incidunt commodi in eveniet officiis vitae amet aspernatur neque nobis eaque distinctio consequuntur repudiandae dignissimos accusamus dolorum.
795,11,2025-03-10,Mobile equipment,Afternoon,Haul road,Low,True,Ratione ab minima necessitatibus ipsam fugit dignissimos nobis quidem doloremque autem quo modi.
796,11,2024-06-19,Ground fall,Afternoon,Underground,Low,True,Harum minima temporibus eum cum at exercitationem ex ipsa earum dolore praesentium iste provident facere.
797,11,2026-05-21,Fall from height,Day,Haul road,Low,False,Reprehenderit ad ea rerum quibusdam nostrum cum laudantium aliquam vitae explicabo.
798,11,2024-04-16,Ground fall,Night,Camp,High,True,Et vel quos quidem quis aliquam eligendi alias aperiam tenetur voluptates repellendus atque provident saepe vel.
799,11,2023-07-23,Explosives,Afternoon,Workshop,Low,False,Repellendus dolore voluptate iste nostrum deleniti odio tempora eum tenetur eveniet dolores earum explicabo facere laudantium dolore voluptas.
800,11,2024-06-28,Manual handling,Afternoon,Open pit,Low,True,Soluta ratione quas sint eius vel dolor sit distinctio maxime molestias dolores quae facilis nobis optio.
801,11,2023-07-21,Explosives,Night,Camp,Low,True,Aliquam ratione voluptates laborum aliquam molestias error cum quis sit ad amet magni quas ut.
