near_miss_id,site_id,report_date,hazard_category,shift,location_on_site,potential_severity,corrective_action_taken,description
1117,15,2025-07-02,Mobile equipment,Afternoon,Underground,High,True,Et atque fuga atque assumenda enim placeat deleniti nihil.
1118,15,2023-12-22,Ground fall,Night,Processing plant,Low,True,Sit quis numquam sapiente qui excepturi rerum debitis enim cupiditate nam.
1119,15,2025-07-28,Ground fall,Day,Haul road,Medium,False,Voluptates reprehenderit porro omnis cum magni ipsa sint iusto ex itaque nam ipsum.
1120,15,2026-05-01,Manual handling,Night,Camp,Medium,False,Laboriosam impedit aut esse sed pariatur corporis asperiores animi.
1121,15,2024-09-05,Mobile equipment,Afternoon,Haul road,Low,False,Excepturi itaque at est quo suscipit quo voluptate unde natus et exercitationem porro accusamus id suscipit voluptas quae expedita.
1122,15,2023-07-27,Mobile equipment,Night,Processing plant,Medium,False,Rerum unde rem accusantium molestiae quos quas maxime nobis magni in et blanditiis.
1123,15,2023-10-30,Mobile equipment,Day,Underground,Medium,False,Dolores sit distinctio odit ipsam suscipit rem placeat repudiandae dolorum illo cupiditate dolor minus fugiat iure culpa quibusdam quia.
1124,15,2024-09-14,Electrical,Day,Processing plant,Medium,False,Laudantium iure nam ea fugit inventore aliquid consequuntur quia sit dignissimos ducimus mollitia.
1125,15,2023-07-19,Ground fall,Day,Haul road,Low,True,Illo repudiandae a est nihil reprehenderit quam voluptates laborum provident labore itaque quam.
1126,15,2024-10-14,Explosives,Night,Open pit,Low,True,Aperiam ullam minus explicabo accusantium reprehenderit nesciunt odit enim architecto omnis quidem deserunt accusamus natus dignissimos itaque deleniti maxime.
1127,15,2024-06-14,Ground fall,Night,Workshop,High,True,Hic modi consequuntur quo adipisci dicta mollitia inventore doloremque.
1128,15,2023-10-15,Ground fall,Afternoon,Processing plant,Low,False,Illo fuga veritatis laborum molestiae eum ad provident perspiciatis dolorem quam aut excepturi laboriosam placeat.
1129,15,2024-10-06,Ground fall,Night,Open pit,High,True,Est ipsum tempore ab possimus excepturi repudiandae facere.
1130,15,2026-03-08,Mobile equipment,Night,Camp,Medium,False,Dolorem architecto mollitia accusamus asperiores quos dolorum optio quam dolore nisi aut pariatur voluptatum quo eligendi natus veniam.
1131,15,2024-07-03,Ground fall,Night,Open pit,High,True,Provident quidem ab fugit sunt id minus asperiores vel sunt tempore vitae eaque officiis aspernatur nisi laborum.
1132,15,2025-02-20,Manual handling,Night,Open pit,Medium,True,Aliquid esse tempore corporis enim dicta explicabo minus modi accusamus cumque architecto.
1133,15,2024-02-24,Ground fall,Day,Workshop,Medium,True,Modi reiciendis tenetur nulla quis aliquid doloribus reprehenderit officia sit iure ipsam ipsum dolores tenetur quos dolore excepturi saepe.
1134,15,2025-12-18,Ground fall,Afternoon,Camp,Low,False,Numquam tempora quidem unde earum quos repellat officiis explicabo perspiciatis unde beatae dolorem.
1135,15,2026-02-06,Ground fall,Day,Processing plant,Medium,False,Est nulla minus ut deserunt inventore exercitationem tenetur natus eligendi.
1136,15,2024-01-28,Mobile equipment,Day,Workshop,Low,True,Repellendus tenetur maiores tempore fugit mollitia recusandae occaecati rerum odit.
1137,15,2024-02-08,Explosives,Day,Open pit,High,False,Officia alias libero necessitatibus quam esse ducimus unde.
1138,15,2025-08-04,Ground fall,Night,Haul road,High,False,Molestias eius perspiciatis eum autem exercitationem ut dolorem nostrum adipisci dolor.
1139,15,2024-03-14,Mobile equipment,Night,Workshop,High,False,Nemo explicabo ea a expedita ipsa natus iure laboriosam tenetur quisquam numquam ipsum odit.
1140,15,2024-07-05,Mobile equipment,Day,Open pit,High,True,Ab doloremque excepturi consectetur non quas officiis quis velit molestias enim temporibus delectus voluptate at.
1141,15,2023-07-02,Mobile equipment,Night,Underground,High,False,Omnis magnam suscipit consequatur autem voluptatem occaecati hic delectus culpa recusandae commodi.
1142,15,2024-05-07,Ground fall,Afternoon,Processing plant,Medium,False,Explicabo enim excepturi dolor atque rerum unde dolorum atque quo voluptas officiis.
1143,15,2024-02-25,Mobile equipment,Day,Open pit,Medium,True,Quam voluptatem tempora praesentium doloribus architecto sunt fugiat ipsa et numquam modi nobis quo.
1144,15,2025-12-20,Mobile equipment,Day,Camp,Medium,True,Corporis quo sapiente ullam delectus voluptas dolor beatae est mollitia fugiat officiis provident.
1145,15,2023-07-27,Ground fall,Afternoon,Workshop,Medium,False,Voluptas veniam enim sint a incidunt nisi occaecati architecto fuga quos minus laboriosam dicta aliquam vero.
1146,15,2023-08-07,Ground fall,Afternoon,Camp,High,True,Odit consectetur assumenda cupiditate maiores accusamus commodi dolor.
1147,15,2025-06-12,Explosives,Day,Open pit,Medium,False,Dolorum sed neque sequi veritatis nam tenetur dolorem occaecati nulla a.
1148,15,2026-01-25,Fall from height,Day,Processing plant,Low,True,Itaque aliquam facere ab reiciendis libero cum mollitia fugiat totam vel nulla.
1149,15,2023-12-07,Explosives,Afternoon,Haul road,Low,True,Maiores totam doloremque quod illo commodi perferendis ratione quas voluptates.
1150,15,2026-02-23,Electrical,Night,Camp,High,False,Cumque distinctio quis a dolor optio expedita magni doloribus ut.
1151,15,2025-11-16,Fall from height,Afternoon,Underground,High,True,Vitae magnam in iusto iure modi impedit repudiandae neque a repellendus aliquam excepturi.
1152,15,2023-11-19,Mobile equipment,Day,Open pit,Medium,True,Magnam libero blanditiis odit placeat numquam numquam maxime fuga distinctio laborum.
1153,15,2026-04-16,Electrical,Afternoon,Camp,High,False,Impedit eaque aspernatur blanditiis adipisci rerum mollitia suscipit deserunt esse quod.
1154,15,2023-08-16,Hazardous substances,Afternoon,Haul road,High,False,Ut aspernatur dolore quas amet laudantium cumque reprehenderit eum rerum.
1155,15,2023-06-30,Fall from height,Night,Open pit,Low,False,Quaerat dolorum ad adipisci soluta quasi modi suscipit voluptatibus.
1156,15,2025-07-19,Fall from height,Night,Open pit,Medium,False,Minus repellendus omnis voluptas minus voluptatibus architecto dignissimos temporibus qui dolore fuga.
1157,15,2026-01-24,Fall from height,Night,Processing plant,Low,False,Pariatur quae cum reprehenderit eius id facere pariatur eligendi.
1158,15,2024-03-02,Hazardous substances,Day,Underground,Low,False,Dolor provident natus minima quae temporibus exercitationem veritatis.
1159,15,2024-10-15,Mobile equipment,Day,Workshop,Medium,False,Reiciendis autem nisi distinctio incidunt tempore error doloribus aliquid eaque dolorem modi.
1160,15,2025-09-01,Ground fall,Day,Processing plant,Medium,True,Ex quos quia cumque labore at voluptatibus sit soluta dolores modi veritatis corporis nisi.
1161,15,2025-03-11,Ground fall,Night,Haul road,High,False,Blanditiis aliquid nostrum vero distinctio repellat fugit vitae quos voluptates odit dolorum.
1162,15,2025-08-31,Fall from height,Day,Haul road,Medium,True,Voluptates voluptatibus ratione sapiente necessitatibus maxime non molestiae ipsam odio.
1163,15,2023-10-24,Ground fall,Afternoon,Underground,Medium,True,Laborum suscipit id laboriosam ab officia iste nobis qui laboriosam voluptate et eos omnis praesentium autem inventore blanditiis culpa.
1164,15,2024-08-04,Ground fall,Afternoon,Open pit,High,False,At ipsam numquam neque cupiditate ratione quia quod velit nulla maxime aperiam dolor expedita quibusdam dolor provident sapiente reprehenderit.
1165,16,2024-10-25,Electrical,Day,Open pit,Medium,True,Sequi mollitia iure repudiandae est eligendi sapiente quod quas laudantium error quaerat temporibus quis ut quod nesciunt.
1166,16,2025-01-27,Electrical,Night,Camp,High,True,Quibusdam reprehenderit delectus quibusdam occaecati nisi illo eos nam optio error iste laborum consequuntur accusantium veritatis.
1167,16,2026-02-24,Fall from height,Night,Camp,Medium,True,Aut modi mollitia deserunt placeat officia sed tenetur assumenda occaecati voluptas saepe quibusdam quia deleniti dicta officia non et.
1168,16,2024-08-22,Electrical,Night,Open pit,Low,False,Velit debitis praesentium quod fuga quod sequi occaecati nam recusandae cumque ratione culpa delectus dolorem libero doloribus soluta excepturi.
1169,16,2024-08-09,Fall from height,Night,Haul road,High,False,Quia excepturi necessitatibus dicta dolores nemo quod nobis soluta nisi excepturi sapiente inventore porro id.
1170,16,2025-10-23,Hazardous substances,Day,Open pit,Medium,True,Quisquam quisquam ullam aliquid reiciendis suscipit fugiat sint sequi earum provident placeat sequi maiores excepturi neque similique provident.
1171,16,2023-10-15,Explosives,Night,Haul road,High,False,Impedit nulla ad illo ducimus maiores unde in consequuntur atque exercitationem dolorum doloremque voluptatum consequatur.
1172,16,2023-09-14,Hazardous substances,Night,Open pit,Low,False,Laborum exercitationem tempora minus saepe magnam perferendis fuga dolorem accusantium laboriosam nemo assumenda mollitia.
1173,16,2025-02-17,Hazardous substances,Afternoon,Haul road,Low,True,Quia aliquam ea autem eum maxime commodi quam iure ratione reiciendis ab in possimus vero explicabo dolore distinctio alias.
1174,16,2023-09-05,Explosives,Afternoon,Processing plant,High,True,Iure consectetur nam praesentium nemo maxime natus deleniti numquam ducimus ut praesentium excepturi fugit.
1175,16,2025-12-25,Fall from height,Afternoon,Haul road,Medium,False,Amet eaque perferendis quas voluptatem nobis odio hic tempora quo cumque harum ducimus.
1176,16,2024-10-27,Hazardous substances,Night,Underground,Low,True,Commodi delectus id voluptatibus soluta placeat laboriosam ducimus reprehenderit tempora eveniet.
1177,16,2024-03-24,Mobile equipment,Day,Workshop,Medium,False,Quas debitis asperiores est possimus minus quae cupiditate explicabo ducimus sunt modi ipsum.
1178,16,2026-05-20,Mobile equipment,Day,Underground,Low,False,Hic voluptatibus praesentium repellendus impedit blanditiis ex dolorum.
1179,16,2024-11-22,Fall from height,Afternoon,Haul road,Medium,True,Aspernatur quod cumque consequatur pariatur minus maiores pariatur praesentium quia.
1180,16,2024-12-14,Explosives,Night,Open pit,Low,False,Porro reprehenderit eligendi consectetur commodi officia magni aspernatur fugit laborum accusantium.
1181,16,2025-02-26,Fall from height,Night,Processing plant,Low,False,Minima adipisci voluptatibus eos dolorem similique repellendus voluptatem non illum unde corrupti architecto maxime.
1182,16,2023-10-17,Fall from height,Night,Underground,Medium,False,Corporis ad consequatur eveniet doloremque sint rem earum porro magni facilis cum exercitationem.
1183,16,2025-08-20,Fall from height,Night,Workshop,High,True,Ut dignissimos ipsum sequi nemo autem et nobis voluptate labore earum dolorem.
1184,16,2026-01-08,Mobile equipment,Night,Processing plant,Low,True,Aperiam rem quaerat explicabo optio iusto molestiae veniam voluptates iusto adipisci amet.
1185,16,2023-07-13,Mobile equipment,Day,Haul road,Medium,True,Perspiciatis possimus expedita sed saepe magnam rem eum itaque nulla ex laboriosam modi.
1186,16,2025-08-13,Mobile equipment,Day,Workshop,High,True,Facere ipsum quam debitis nam occaecati placeat odio quia reiciendis repudiandae porro ea ex earum officiis repudiandae.
1187,16,2025-07-19,Ground fall,Afternoon,Camp,High,True,Maiores ad quos aperiam minima recusandae veritatis eum molestiae accusamus ex voluptatum molestias ad quis dolorem.
1188,16,2025-03-03,Mobile equipment,Afternoon,Processing plant,Low,False,Eligendi amet debitis eveniet fuga doloremque totam dignissimos fugit maiores.
1189,16,2023-11-12,Fall from height,Night,Camp,High,False,Voluptatem vero sit ut debitis magnam at perspiciatis nisi provident omnis commodi et quia fugit.
1190,16,2024-07-15,Ground fall,Night,Open pit,High,False,At impedit ea omnis porro eos vitae magni illum quis.
1191,16,2025-05-18,Explosives,Afternoon,Haul road,Medium,False,Odio iste minus eum non laudantium impedit maiores non harum unde.
1192,16,2024-12-26,Mobile equipment,Night,Processing plant,High,False,Distinctio dolores a eaque iure commodi totam dolore doloribus unde at illum quisquam exercitationem nam nisi.
1193,16,2025-12-26,Ground fall,Afternoon,Haul road,Medium,True,Fugit odio autem magni id a adipisci ipsum possimus eos quos nemo ipsa dolorem.
1194,16,2023-06-11,Ground fall,Day,Underground,High,False,Esse occaecati eos reiciendis rem aspernatur corrupti quis voluptatum provident inventore.
1195,16,2026-04-08,Ground fall,Day,Underground,Medium,True,Eveniet nesciunt temporibus molestias reiciendis deleniti consectetur veritatis quas similique animi exercitationem accusamus deserunt corporis at.
1196,16,2025-05-01,Electrical,Afternoon,Processing plant,High,True,Aliquam optio ad earum eius earum aut quidem optio accusamus officia dolorem quisquam sed necessitatibus itaque dolores dignissimos possimus.
1197,16,2025-04-22,Ground fall,Night,Underground,Medium,False,Dolorum mollitia officiis assumenda architecto placeat neque nulla odio.
1198,16,2025-05-13,Mobile equipment,Night,Underground,High,True,Minus aut nostrum non tempore iste blanditiis aspernatur dolore nostrum eos magni unde.
1199,16,2023-11-17,Hazardous substances,Day,Processing plant,Medium,False,Veritatis cupiditate est laudantium recusandae dolorem odio possimus accusantium modi.
1200,16,2025-11-27,Ground fall,Night,Workshop,High,True,Sapiente minus reprehenderit soluta illum ducimus maiores velit quasi dolor atque iusto sequi doloremque nostrum aliquam perferendis tempora animi.
1201,16,2025-04-03,Mobile equipment,Night,Open pit,Low,False,Voluptatibus dolorum eligendi placeat aut incidunt nihil inventore dolore reprehenderit vel sed molestias.
1202,16,2025-03-06,Ground fall,Day,Haul road,High,True,Nihil magnam suscipit at qui dolorum debitis ut inventore assumenda ex quidem velit.
1203,16,2024-09-20,Mobile equipment,Night,Camp,Low,True,Asperiores ipsum unde dolore nemo in temporibus laborum eos.
1204,16,2025-02-07,Explosives,Day,Underground,Low,False,Distinctio quisquam at enim consectetur occaecati libero a esse aut harum a voluptates dolorum.
1205,16,2024-05-19,Explosives,Day,Processing plant,Low,True,Aspernatur maiores cumque magni consectetur voluptatibus totam quae repellat laudantium repellendus voluptatem soluta veniam id.
1206,16,2023-08-18,Ground fall,Afternoon,Processing plant,High,True,Dolor doloribus accusamus doloremque possimus quam voluptatum ipsam laborum.
1207,16,2025-10-08,Mobile equipment,Night,Open pit,Low,False,Repellendus reiciendis ad debitis odio deleniti maxime tempora.
1208,16,2026-03-26,Hazardous substances,Afternoon,Processing plant,Medium,True,Aut inventore repellat enim rem velit ut facilis vel blanditiis adipisci animi sunt sit hic deleniti iure adipisci fugiat.
1209,16,2023-09-22,Mobile equipment,Night,Open pit,Medium,False,Laudantium voluptatem commodi dicta facilis provident reprehenderit cupiditate modi optio.
1210,16,2024-08-01,Fall from height,Day,Camp,Medium,False,Ea natus excepturi dolor id mollitia laborum iusto aliquam enim ex praesentium deserunt.
1211,16,2023-09-23,Ground fall,Night,Workshop,Medium,True,Assumenda cumque incidunt dolores tempore voluptatem provident dolorum voluptatem aperiam ullam.
1212,16,2026-04-29,Mobile equipment,Night,Workshop,High,True,Pariatur at consequatur asperiores sit hic sint autem consequatur vitae quis debitis distinctio aut nemo molestiae.
1213,16,2023-10-22,Explosives,Day,Camp,Medium,True,Minima repellat minus cupiditate debitis accusantium laboriosam doloribus deleniti accusamus accusamus omnis ipsum nobis expedita neque voluptas aliquid ratione.
1214,16,2024-11-19,Mobile equipment,Night,Open pit,Medium,False,Hic repellat itaque et facilis aliquid hic quam ratione corporis pariatur temporibus.
1215,16,2023-07-26,Electrical,Day,Open pit,Medium,True,Quibusdam atque esse magni praesentium earum explicabo non ex ab impedit doloremque minus architecto nam itaque assumenda.
1216,16,2026-04-25,Mobile equipment,Afternoon,Haul road,Low,True,Ab ipsum illo ut saepe magni itaque reprehenderit aperiam temporibus libero nulla facilis facere dolorem.
1217,16,2023-12-07,Electrical,Night,Underground,Medium,False,Ut sit quos non unde explicabo veritatis pariatur voluptates.
1218,16,2024-10-26,Hazardous substances,Night,Workshop,High,True,Quos quasi repellendus aliquam neque eius ad voluptates reiciendis quisquam voluptatem ad sapiente beatae adipisci.
1219,16,2024-06-03,Fall from height,Night,Workshop,High,False,Optio error aperiam illo deserunt quia repudiandae reprehenderit nihil.
1220,16,2024-12-16,Mobile equipment,Night,Workshop,High,False,Quos a at at autem cum autem velit magni asperiores temporibus illum quam officia laboriosam reiciendis explicabo dolores.
1221,16,2023-08-11,Fall from height,Day,Processing plant,Medium,False,Odio earum aliquid praesentium eveniet eveniet assumenda nulla amet similique facere repellat.
1222,16,2024-07-13,Manual handling,Night,Open pit,Low,True,Eaque expedita accusantium in maxime ad vero error cumque corporis.
1223,16,2023-12-08,Fall from height,Night,Haul road,High,True,Saepe mollitia assumenda illo deserunt nostrum labore esse qui itaque quam.
1224,16,2023-12-26,Ground fall,Night,Workshop,Medium,True,Sequi eius excepturi distinctio minima facere aut quia iusto eveniet libero dignissimos aut officia.
1225,16,2025-09-15,Fall from height,Afternoon,Camp,Low,False,Itaque cum placeat illum autem nihil occaecati magni voluptates neque atque nostrum iste.
1226,16,2024-10-16,Ground fall,Afternoon,Open pit,Medium,True,Eius sint hic rerum eum molestias nulla dolores numquam recusandae eum.
1227,16,2023-12-30,Ground fall,Night,Haul road,High,False,Aperiam sunt harum laborum pariatur dolorem ratione blanditiis incidunt deleniti nulla aliquid rem eos dolorum aliquid.
1228,16,2023-10-07,Ground fall,Afternoon,Underground,Medium,True,Porro officiis fugit sed pariatur asperiores tempore dolorum nam.
1229,16,2026-05-23,Ground fall,Night,Processing plant,Medium,False,Aut corrupti nobis corporis repellat itaque blanditiis quod pariatur illo fugiat sequi.
1230,16,2025-06-21,Fall from height,Afternoon,Workshop,Low,True,Nulla veritatis quia earum eaque libero magnam porro sed.
1231,16,2024-11-17,Ground fall,Night,Camp,High,False,Voluptatem dolorem quod aliquid nobis molestiae soluta accusantium praesentium assumenda blanditiis dolor laborum vero excepturi maiores maiores consequuntur corporis.
1232,16,2025-08-10,Electrical,Afternoon,Haul road,High,False,Dolorum officia esse necessitatibus eaque blanditiis perferendis numquam placeat neque asperiores quibusdam temporibus nostrum repellat impedit sapiente quidem.
1233,16,2024-07-02,Ground fall,Afternoon,Workshop,Medium,False,Alias illum aut dolore quos corrupti vel molestiae culpa eveniet sunt.
1234,16,2024-12-09,Explosives,Night,Haul road,High,False,Quasi aperiam recusandae doloremque soluta voluptatum deserunt perferendis in labore nulla minima deleniti sit.
1235,16,2023-10-21,Mobile equipment,Afternoon,Open pit,Medium,False,Magnam recusandae velit ipsam totam hic maxime at deleniti ab deleniti voluptatibus.
1236,16,2023-11-22,Mobile equipment,Day,Processing plant,Medium,False,Fugit minus in ex exercitationem libero rem facere qui deleniti optio consequuntur perspiciatis voluptate.
1237,16,2026-01-06,Electrical,Afternoon,Workshop,Medium,True,Deserunt reiciendis tenetur officiis placeat provident officiis voluptate beatae dignissimos illum corrupti nihil ducimus reprehenderit ratione.
1238,16,2024-11-08,Fall from height,Afternoon,Processing plant,Low,True,Possimus et animi earum quasi quasi perspiciatis repudiandae.
1239,16,2023-06-17,Explosives,Night,Open pit,Medium,True,Atque provident soluta delectus architecto magni optio molestias tenetur saepe.
1240,16,2025-07-28,Ground fall,Afternoon,Processing plant,Medium,False,Nam hic ab non quo ab suscipit ut veniam labore quidem fugiat.
1241,16,2025-07-07,Explosives,Night,Underground,Medium,False,Quae est autem necessitatibus quos dolorum beatae quis quia natus ut possimus dolore omnis.
1242,16,2026-01-30,Explosives,Day,Open pit,Medium,False,Dicta magnam cumque vero deserunt recusandae soluta soluta rerum.
1243,16,2024-01-22,Fall from height,Afternoon,Underground,Low,True,Quod blanditiis ex reprehenderit corrupti dolor tempore iusto minus amet ipsam.
1244,16,2023-11-20,Fall from height,Night,Workshop,Low,True,Delectus laborum vel sapiente deserunt laborum minus perferendis a iure excepturi quidem nisi pariatur error libero nobis.
1245,16,2024-10-11,Ground fall,Day,Processing plant,Low,False,Impedit aperiam voluptatum aliquam facere similique rerum minus aperiam possimus consequatur necessitatibus.
1246,16,2023-12-14,Mobile equipment,Afternoon,Camp,High,False,Eum similique aspernatur architecto minima expedita nihil maiores.
1247,16,2023-11-04,Mobile equipment,Day,Processing plant,High,True,Ipsum labore rem repudiandae ea dolorum voluptatibus earum.
1248,16,2025-09-26,Mobile equipment,Day,Open pit,Low,False,Harum inventore dignissimos impedit natus assumenda exercitationem inventore ab non neque quam.
1249,16,2023-10-04,Explosives,Day,Open pit,Medium,False,Quidem aliquam reprehenderit aliquid ipsa placeat distinctio harum magnam delectus quasi accusantium.
1250,16,2025-08-07,Mobile equipment,Night,Camp,Medium,True,Eum aliquam quos nam aperiam vitae nisi nostrum labore incidunt facere.
1251,16,2024-06-11,Ground fall,Night,Open pit,Low,False,Facilis nulla recusandae eum ad magnam nostrum voluptatem deleniti error natus nesciunt illo eum quis consequuntur temporibus nemo.
1252,16,2024-10-22,Fall from height,Afternoon,Workshop,High,False,Nam pariatur impedit a culpa quasi corrupti iste repellat rem odio quasi.
1253,16,2024-07-08,Manual handling,Day,Underground,Low,True,Nisi consequuntur at dolorum error tenetur saepe dolorem repellendus est expedita nam modi aspernatur fugit repudiandae delectus eos.
1254,16,2025-11-05,Fall from height,Afternoon,Workshop,Low,False,Ea provident dolorum tenetur ullam nihil nulla incidunt nam aliquam.
1255,16,2025-06-12,Mobile equipment,Night,Workshop,Medium,True,Officiis laudantium vitae quae error et necessitatibus animi corporis atque dolore beatae consequatur amet quam.
1256,16,2025-08-29,Fall from height,Afternoon,Open pit,Low,True,Esse est asperiores consequuntur alias ullam id qui quae sit repellendus facere laboriosam iure nobis optio excepturi.
1257,16,2023-12-18,Hazardous substances,Day,Underground,High,False,Iste soluta voluptate recusandae quis harum quod quae ipsa nostrum magni similique fuga iure minima enim.
1258,16,2024-05-20,Ground fall,Afternoon,Processing plant,Low,False,Eaque odit nostrum hic ullam laborum officiis delectus a est at reprehenderit consectetur animi corrupti iusto distinctio libero.
1259,16,2026-03-29,Mobile equipment,Night,Camp,Medium,True,Provident suscipit recusandae neque dolor doloribus blanditiis voluptate consequatur eos omnis tempora et et.
1260,16,2026-02-21,Mobile equipment,Afternoon,Camp,Low,False,Eius soluta laborum asperiores assumenda at asperiores iusto laborum possimus consequuntur iure rem fugit voluptatum amet aperiam.
1261,16,2024-03-04,Manual handling,Night,Underground,Medium,True,Iure omnis optio aut laborum animi nemo eius ullam illo voluptatem sit itaque minima nesciunt minus.
1262,16,2023-06-18,Ground fall,Night,Camp,Low,False,Maxime quibusdam ullam doloremque laboriosam a maiores accusantium vitae omnis neque commodi tempora ea dolores eveniet corrupti perferendis corrupti.
1263,16,2025-09-28,Electrical,Afternoon,Processing plant,Low,True,Quasi quod voluptatibus aliquid optio saepe perferendis repellendus aperiam nostrum in veniam quas quam ratione quisquam nam amet.
1264,17,2025-08-06,Hazardous substances,Afternoon,Processing plant,High,False,Tempora ipsam numquam quaerat dolores consectetur molestias reiciendis fuga adipisci.
1265,17,2025-10-08,Mobile equipment,Afternoon,Processing plant,High,True,Eos non nesciunt molestias asperiores omnis illum quasi autem excepturi consequatur iure id ad harum reiciendis fugiat ipsam.
1266,17,2023-07-01,Electrical,Day,Open pit,Low,True,Neque illum impedit officiis repellat facilis impedit sint magni assumenda corrupti.
1267,17,2024-10-27,Ground fall,Night,Workshop,Medium,False,Iure in tempore iste accusamus voluptatum asperiores alias perspiciatis necessitatibus sequi optio minus autem expedita.
1268,17,2025-09-13,Fall from height,Night,Camp,Low,False,Tempora illo quae aperiam qui odio dolores dicta fuga debitis laborum necessitatibus amet temporibus tempora tempora dolores.
1269,17,2026-03-09,Mobile equipment,Afternoon,Underground,Low,False,Error delectus fugit porro assumenda quae illum labore iure sint magnam suscipit alias quam earum occaecati numquam.
1270,17,2023-07-22,Fall from height,Night,Camp,Low,False,Qui est non debitis temporibus expedita unde ducimus.
1271,17,2023-12-09,Ground fall,Day,Haul road,High,False,Minima consectetur itaque fuga itaque corrupti sequi qui ab culpa laboriosam atque laborum voluptates voluptates laudantium recusandae hic possimus.
1272,17,2023-12-23,Fall from height,Day,Workshop,Medium,True,Atque laborum quia nemo voluptatem porro tenetur numquam vero numquam debitis nihil ipsum voluptate.
1273,17,2023-12-07,Fall from height,Day,Open pit,High,False,Culpa a optio quia maxime ipsam quos veniam voluptate possimus eos corporis cumque laborum repellat.
1274,17,2025-03-31,Manual handling,Day,Processing plant,Medium,True,Tenetur eum sunt necessitatibus vitae officia numquam assumenda aut.
1275,17,2025-01-23,Ground fall,Night,Underground,Medium,True,Magni necessitatibus reprehenderit quas temporibus doloremque aliquid sint quisquam ipsam.
1276,17,2024-08-28,Mobile equipment,Day,Processing plant,Low,False,Nostrum neque reiciendis neque perferendis adipisci rerum voluptatum eligendi dignissimos error consectetur ratione quae commodi enim dicta asperiores.
